"La obtención, con fecha 05 de febrero de 2019, de Niveles de Presión Sonora Corregidos (NPC) de 61 dB(A), 61 dB(A), 54 dB(A), 57 dB(A), 54 dB(A) y 50 dB(A), las dos primeras mediciones efectuadas en horario diurno y las restantes en horario nocturno, en condición externa, la primera, segunda, tercera y quinta y, en condición interna con ventana abierta la cuarta y sexta, todas en receptores sensibles ubicados en Zona II.",NE,h,Leves,,,,
"Modificar el diseño de disposición de efluentes considerado en la RCA Nº 57/2011, a través de la construcción y operación de un ducto de descarga al mar, sin contar con una resolución de calificación ambiental que lo autorice.",Elusión,b,Graves,,,,
"El establecimiento industrial, no informó los remuestreos en los meses en que excedió los límites máximos establecidos en la Tabla N° 2, del D.S. N° 46/2002, correspondiendo estos a los siguientes: Enero, Febrero, Marzo, Abril, Mayo, Junio, Septiembre, Octubre, Noviembre y Diciembre del año 2013, y Enero, Febrero, Marzo, Abril, Mayo, Junio, Julio y Agosto del año 2014",NE,g,Leves,,,,
"NO REPORTAR LA FRECUENCIA DE MONITOREO EXIGIDA EN SU PROGRAMA DE MONITOREO: El establecimiento industrial no reportó la frecuencia de monitoreo exigida en su Programa de Monitoreo, para los siguientes parámetros durante los períodos que a continuación se indican, y que se detallan en la Tabla Nº 3 del Anexo de la presente Resolución: - pH: en los meses de abril y septiembre del año 2019; en los meses de febrero, marzo, abril, mayo, junio y julio del año 2020.",NE,g,Leves,,,,
Falta de implementación de proceso de acondicionamiento de lodos sanitarios al no mezclarse estos con residuos de madera como viruta o aserrín.,RCA,a,Graves,3.2,O,EIA,2.2399999999999998
"El alumbrado de exteriores del Edificio Corporativo de Minera Escondida incumple las exigencias establecidas en relación a la emisión de intensidad luminosa, toda vez que: a) Las luminarias identificadas como N° 2, 3, 10, 12, 14, 15, 16, 17 se encuentran instaladas con un ángulo de inclinación que implica una distribución de intensidad luminosa que excede a la permitida para un ángulo gama mayor a 90°. b) Las luminarias de alumbrado deportivo identificadas como N° 5, 8 y 9 se encuentran instaladas sin la adición de una visera que limite la emisión hacia el hemisferio superior.",NE,h,Leves,,,,
"Las luminarias N° 2, 3, 5, 7 y 8 señaladas en la Tabla N° 1 de la Res. Ex. Nº 1/Rol F-063-2021, que forman parte del sistema de alumbrado ambiental, y deportivo y recreacional del Estadio Luis Valenzuela Hermosilla, se encuentran instaladas con un ángulo de inclinación que implica una distribución de intensidad luminosa que excede a la permitida para un ángulo gama mayor a 90°.",NE,h,Leves,,,,
"2) Omisión de efectuar monitoreos de Riles Ey de mantener registro de información relativo a la aplicación de RILes en suelo, respecto de los parámetros pH, SST ni DBO5, desde el año 2017 a 2019.",RCA,a,Graves,0.0825,O,DIA,0.057749999999999996
"Falta de respuesta al requerimiento de información, formulado en Acta de Inspección de 14 de noviembre de 2016, sobre análisis de calidad de agua de deshielo en sector aguas abajo del Depósito de Lastre.",Requerimientos de Información,j,Leves,1700.0,I,EIA,1190.0
"La obtención, con fecha 26 de mayo de 2022, de un Nivel de Presión Sonora Corregido (NPC) de 53 dB(A), medición efectuada en horario nocturno, en condición externa y en un receptor sensible ubicado en Zona II.",NE,h,Leves,,,,
Inexistencia de plantación de 490 Guayacanes.,RCA,a,Graves,0.0,I,DIA,0.0
"La obtención de un nivel de presión sonora corregido en medición exterior en horario diurno, de 73 dB(A); en medición exterior en horario nocturno, de 74 dB(A); en medición interior con ventana abierta en horario nocturno, de 74 dB(A); en medición interior con ventana cerrada en horario nocturno, 71 dB(A), realizadas con fecha 26 de agosto de 2016, presentándose excedencias de 13 dB(A), 29 dB(A), 29 dB(A) y 26 dB(A) respectivamente.",NE,h,Leves,,,,
"La obtención, con fecha 27 de agosto de 2023, de unos Niveles de Presión Sonora Corregidos (NPC) de 67 dB(A), 69 dB(A), 70 dB(A), 66 dB(A) y 69 dB(A), todas las mediciones efectuadas en horario nocturno, en condición interna con ventana cerrada la primera y cuarta, y en condición externa las restantes, y en receptores sensibles ubicados en Zona III.",NE,h,Leves,,,,
"La explotación de la cantera no se desarrolló en terrazas en el frente norte de la misma, lo que ocasionó rotura de la ruta O-582 según lo constatado en la fiscalización de junio del año 2014, generando un daño en propiedad fiscal y riesgo a la seguridad de los transeúntes.",RCA,a,Graves,1.26,I,DIA,0.8819999999999999
"No se cuenta con elementos para estacionar bicicletas o “bicicleteros” en accesos en el sector sur del Humedal, a la fecha de la inspección ambiental.",RCA,a,Leves,0.0273,P,DIA,0.01911
"El establecimiento industrial presentó superación del límite máximo permitido en el D.S. N° 90/2000, en uno o más contaminantes, durante los meses de octubre de 2013 y junio de 2014, tal como se presenta en la Tabla N°4 de la presente resolución.",RCA,a,Leves,0.46,O,DIA,0.322
"Modificación al proyecto de extracción de áridos desde pozo lastre sin evaluación ambiental previa a su ejecución, consistente en extracción en una superficie intervenida no evaluada, correspondiente a extracción distinta, desde pozo lastre, por un total de 9,76 ha.",RCA,b,Graves,1.07,,DIA,0.749
"La obtención, con fecha 27 de enero de 2019, de Nivel de Presión Sonora Corregidos (NPC) de 60 dB(A), medición efectuada en horario nocturno, en condición externa, en un receptor sensible ubicado en Zona II.",NE,h,Leves,,,,
"NO REPORTAR LA FRECUENCIA DE MONITOREO EXIGIDA EN SU PROGRAMA DE MONITOREO: El establecimiento industrial no reportó la frecuencia de monitoreo exigida en su Programa de Monitoreo [Resolución Exenta SISS N° 232, de fecha 29 de enero de 2010] respecto del parámetro caudal, en los meses de marzo, mayo, septiembre, octubre y diciembre, todos de 2021, lo cual se detallan en la Tabla N° 1.1 del Anexo de la presente Resolución.",NE,g,Leves,,,,
No se ha ejecutado en su totalidad el Plan de Manejo de Preservación aprobado por Resolución N° 13/2710/01.,RCA,a,Graves,3.9,I,DIA,2.73
"Compactación y erosión del suelo debido al tránsito de maquinarias y a la disposición de material pedregoso sobre el Desierto Florido, lo cual evita la germinación de especies propias de dicho fenómeno. Ello se observó en coordenadas 356976/6964134, así como en torres 420 y 422 y polígono de acopio N°17.",RCA,a,Graves,6.0,B,DIA,4.199999999999999
A1 No implementación de cordón de protección perimetral a la Planta SX con 60 pimientos.,RCA,a,Leves,1.0,I,DIA,0.7
"La obtención, con fechas 20 de julio de 2021 y 06 de diciembre de 2022, de Niveles de Presión Sonora Corregidos (NPC) de 75 dB(A) y 72 dB(A) respectivamente, ambas mediciones efectuadas en horario diurno, en condición externa en un receptor sensible ubicado en Zona III.",NE,h,Leves,,,,
"El establecimiento industrial no reportó en los reportes de autocontrol de su Programa de Monitoreo (Res. Ex. SISS N° 3073, de fecha 30 de agosto del año 2006), el parámetro Temperatura, durante el mes de julio de 2019; según se detalla en la Tabla N°1.1 del Anexo Nº 1 de la presente Resolución.",NE,g,Leves,,,,
No contar con tabla de conversión de energía de la leña en un lugar visible del establecimiento.,PPDA,c,Leves,,,,
"El establecimiento industrial no reportó información asociada a los remuestreos de los parámetros, en los periodos que a continuación se indican, y que se detallan en la Tabla N° 1.2 de la presente Resolución: -Aluminio: octubre (2021); junio, agosto, noviembre (2022) -Cloruros: enero, febrero, marzo, mayo (2021); diciembre (2022). -Hierro Disuelto: octubre (2021). -Sólidos Suspendidos Totales: octubre (2021).",NE,g,Leves,,,,
"La obtención, con fecha 07 de abril de 2017, de un Nivel de Presión Sonora Corregidos (NPC) de 67 dB(A), medición efectuada en horario diurno, en condición externa, en un receptor sensible ubicado en Zona II.",NE,h,Leves,,,,
"Implementación deficiente de las medidas para minimizar riesgo de incendio y medidas para actuar en caso incendios, en particular: a)	No mantener control permanente de acceso al proyecto de personas ajenas a la faena. b)	Presencia de extintores vencidos c)	Irregular conformación y capacitación de la brigada contra incendios. d)	Mantención de un depósito de combustibles en condiciones diferentes a lo establecido en la RCA N° 747/2003, el cual está conformado por un depósito plástico con 900 litros de petróleo, sobre un piso de cemento sin piscina antiderrames.",RCA,a,Graves,1.442,O,DIA,1.0093999999999999
"Haber superado el límite máximo de emisión de MP respecto de la caldera N° 4, con registro N° SSCON-118, para el año 2022, donde se obtuvo una concentración de 380 mg/m?N.",PPDA,c,Leves,,,,
"Incumplimiento del Plan de Gestión de Olores (PGO) en el plantel Basal, en tanto, la fracción sólida (guano) no se almacena en contenedores estancos y no se retira con frecuencia diaria.",RCA,a,Graves,5.83,L,DIA,4.0809999999999995
E. Ausencia del último informe de monitoreo de las áreas de reforestación definidas en el plan de manejo aprobado por CONAF,RCA,a,Leves,250.0,I,EIA,175.0
"Superar la producción máxima autorizada en el CES Morgan (RNA 120136), durante el ciclo productivo ocurrido entre el 14 de octubre de 2019 y el 16 de mayo de 2021",RCA,a,Graves,2.4,N,DIA,1.68
"No reportar la descarga efectuada en el mes de agosto de 2015, al canal que desemboca en el estero Cholqui, debiendo hacerlo, en razón de lo constatado en la inspección ambiental.",NE,g,Leves,,,,
"No haber incorporado señalética informativa que dé cuenta del atractivo turístico de Caleta Chañaral y Reserva Pingüinos de Humboldt, en el sector cruce de la línea de transmisión eléctrica con la Ruta C-500.",RCA,a,Leves,64.0,B,DIA,44.8
No determinar la calidad natural del acuífero al haberse determinado Vulnerabilidad Alta.,NE,g,Leves,0.1,O,DIA,0.06999999999999999
"El incumplimiento a lo dispuesto en los artículos 49, 55, 56 y 97 del Decreto Supremo 66 de 2009, del Ministerio Secretaría General de la Presidencia, que establece Plan de Descontaminación Atmosférica de la Región Metropolitana.",PPDA,c,Graves,,,,
Producción de guano en volúmenes mensuales mayores a los establecidos en la RCA entre junio de 2020 y diciembre de 2020.,RCA,a,Leves,0.71,L,DIA,0.49699999999999994
Cerco perimetral discontinuo y en mal estado a lo largo del perímetro del Vertedero Victoria.,Otro,a,Graves,1.8516,O,DIA,1.29612
"No se ha instalado la barrera acústica en la parte alta del área de extracción, donde se encuentra el límite con el vecino (R N°6), de acuerdo a lo dispuesto en la RCA N° 131/2005.",RCA,a,Graves,0.7,I,EIA,0.48999999999999994
"Incumplimiento de obligaciones asociadas al manejo de aguas lluvias, líquidos lixiviados, consistente en: a. Deficiente implementación de sistema de canalización de aguas lluvias en estaciones E1 y E2 e inexistente sistema de manejo de aguas lluvias en estaciones E3 y E4. b. Deficiente implementación de sistema de manejo de lixiviados en estaciones E1 y E2 e inexistente sistema de manejo de lixiviados en estaciones E3 y E4.",RCA,a,Graves,1.2062,,DIA,0.8443399999999999
"A.8 Canaletas colectoras de soluciones lixiviadas de las pilas de lixiviación no cumplen su función adecuadamente, generándose apozamientos de soluciones lixiviadas fuera de ellas.",RCA,a,Leves,8.0,I,DIA,5.6
"La obtención, con fecha 01 y 02 de marzo de 2019, de Nivel de Presión Sonora Corregido (NPC) de 61 dB(A), en horario nocturno, en condición interna y con ventana cerrada; medido en un receptor sensible, ubicado en Zona II",NE,h,Leves,,,,
"La empresa no informa el monitoreo anual de los suelos donde se aplican los Riles, en el periodo 2019-2021.",RCA,a,Leves,0.2697,O,DIA,0.18878999999999999
"La obtención, con fecha 31 de octubre de 2021, de un Nivel de Presión Sonora Corregido (NPC) de 76 dB(A), medición efectuada en horario nocturno, en condición externa y",NE,h,Leves,,,,
"Deficiente implementación de Plan de Contingencias, tras la ocurrencia de incendios",RCA,a,Graves,1.8516,O,DIA,1.29612
"No realizar la extracción de lodos desde los decantadores con la frecuencia comprometida, según lo constatado en la inspección ambiental de fecha 07 de septiembre de 2017.",RCA,a,Leves,0.06,N,DIA,0.041999999999999996
"No existen registros que acrediten que las redes peceras asociadas a los códigos 11208-12 y 2-1232x18+3-35, han sido sometidas a limpieza y lavado, in situ o por servicios externos que cumplan con la normativa vigente.",RCA,a,Leves,2.0,N,DIA,1.4
"El valor de caudal reportado para los meses de diciembre de 2013, enero a diciembre de 2014, y enero, febrero, abril, mayo, junio, julio, agosto, octubre, y diciembre de 2015, fue replicado para todos los días de cada mes",NE,h,Leves,,,,
"La obtención, con fecha 5 de marzo de 2022, de un Nivel de Presión Sonora Corregido (NPC) de 70 dB(A), la medición efectuada en horario nocturno, en condición interna con ventana abierta y en un receptor sensible ubicado en Zona II.",NE,h,Leves,,,,
"NO REPORTAR LA FRECUENCIA DE MONITOREO EXIGIDA EN SU PROGRAMA DE MONITOREO: El establecimiento industrial no reportó la frecuencia de monitoreo exigida en su Programa de Monitoreo (RPM N° 1101/2011), para los parámetros Caudal, pH y Temperatura en los períodos que a continuación se indican, y que se detallan en la Tabla N° 1.3 del Anexo N°1 de la presente Resolución: Entre enero y diciembre de 2022, excluyendo el mes de octubre.",NE,g,Graves,,,,
El titular no respondió el requerimiento de información formulado mediante la Res. Ex. N° 216/2022,Requerimientos de Información,j,Graves,0.05,,,0.034999999999999996
"La obtención, con fecha 3 de junio de 2022, de un Nivel de Presión Sonora Corregido (NPC) de 68 dB(A), medición efectuada en horario nocturno, en condición externa, y en un receptor sensible ubicado en Zona III.",NE,h,Leves,,,,
No dar respuesta a los requerimientos de información de la Superintendencia del Medio Ambiente,RCA,j,Leves,1.3,O,DIA,0.9099999999999999
"El establecimiento industrial no reportó información asociada a los remuestreos requeridos en mayo, junio y septiembre de 2014, y enero, febrero y abril de 2015",RCA,a,Leves,0.275,,DIA,0.1925
"La obtención, con fecha 21 de agosto de 2018, de un Nivel de Presión Sonora Corregidos (NPC) de 72 dB(A), medición efectuada en horario diurno, en condición interna con ventana abierta, en un receptor sensible ubicado en Zona III.",NE,h,Leves,,,,
"Los vehículos de transporte de carga, en lugar de ser aspirados, son lavados en el exterior de los galpones, en un lugar que no se encuentra descrito en la RCA correspondiente.",RCA,a,Graves,0.0,F,DIA,0.0
"La obtención, con fecha 6 de mayo de 2022, de un Nivel de Presión Sonora Corregido (NPC) de 65 dB(A), medición efectuada en horario nocturno, en condición interna, con ventana abierta y en un receptor sensible ubicado en Zona II",NE,h,Leves,,,,
"Extraer áridos fuera del área autorizada, interviniendo un área adicional de 15,9 hectáreas.",RCA,a,Graves,0.05,I,DIA,0.034999999999999996
"No realizar el muestreo de la totalidad de los parámetros exigidos para el bioestabilizado, durante los años 2014 a 2016, consistentes en: - Salmonella y coliformes fecales. - Arsénico, cadmio, cromo, mercurio, niquel, plomo y cromo, según lo exigido en la Tabla N° 4 de la NCh 2880.",RCA,a,Leves,5.2,L,DIA,3.6399999999999997
"Contar con sector de desnivel de alrededor 10 metros de largo contrario a pendiente diseñada, en canales de contorno.",RCA,a,Graves,3.9,I,DIA,2.73
"La obtención, con fecha 28 de marzo de 2019, de Nivel de Presión Sonora Corregido (NPC) de 62, medición efectuada en horario nocturno, en condición externa, en un receptor sensible ubicado en Zona II.",NE,h,Graves,,,,
"Deficiente aplicación de lodos al suelo: se estableció que los biosólidos no se adhieren al suelo, generando zonas de pozas",RCA,a,Graves,1.45,O,DIA,1.015
"No rehabilitación de 36 has. de suelo de clasificación IV, V, VI, VII u VIII, para cumplir con una clasificación final de suelo III.",RCA,a,Graves,492.0,A,EIA,344.4
No dar cumplimiento a las medidas provisionales decretadas mediante Resolución Exenta N° 1062.,,l,Graves,5.8,G,DIA,4.06
Superación por 12 dBA del límite establecido por el D.S. 38/2011 para Zona II en horario nocturno.,NE,h,Leves,,,,
"La obtención, con fecha 25 de septiembre de 2017, de un Nivel de Presión Sonora Corregido (NPC) de 76 dB(A) y 74 dB(A), medidos en receptor sensible ubicado en zona III, en condición externa, en horario diurno y nocturno, respectivamente.",NE,h,Leves,,,,
"Haber superado la capacidad máxima de las piscinas de almacenamiento de lixiviado durante los meses de septiembre, octubre y noviembre de 2013, y julio, agosto, septiembre, octubre y noviembre de 2015, según consta en la Tabla N° 1 de la presente formulación de cargos.",RCA,a,Graves,1236.0,O,DIA,865.1999999999999
"Recepción de lodos sanitarios con humedades superiores al 82%, en forma reiterada y continua, sin proceder a la detención del ingreso de los lodos provenientes las plantas correspondientes, ni dar aviso a la autoridad competente.",RCA,a,Graves,1.7,O,DIA,1.19
"No contar con la tramitación sectorial del Permiso Ambiental Sectorial 96 del D.S. N° 95 del Ministerio Secretaria General de la Presidencia, Reglamento del sistema de Evaluación de Impacto Ambiental.",RCA,a,Leves,0.4,I,DIA,0.27999999999999997
"El establecimiento industrial no realiza sanitización por UV del efluente previo a su descarga, ni tampoco ecualización de caudal para su control de pH, ni la doble rejilla que evite la salida de ejemplares, durante fiscalización de febrero de 2014.",RCA,a,Leves,5.5,N,DIA,3.8499999999999996
"Construir una alcantarilla para el cruce de camiones por sobre un canal, en contravención a la RCA N° 11/2020, lo que se refleja en: a. Instalar la obra incumpliendo las especificaciones técnicas aprobadas en la RCA N° 11/2020, constatado con fecha 12 de febrero de 2021. b. No contar con el Permiso Ambiental Sectorial 156, requerido previamente a la construcción de la misma.",RCA,a,Leves,,,,
No entregar el monitoreo de fauna requerido durante la actividad de fiscalización de 27 de junio de 2014.,Requerimientos de Información,j,Leves,1.442,O,DIA,1.0093999999999999
La empresa no ha implementado un registrador con datos de flujo en la obra de rebalse de aguas lluvias del patio de maderas.,RCA,a,,1045.0,M,EIA,731.5
"No ejecutar la totalidad de los compromisos relacionados con el cierre del proyecto ""Quinto Horno Deselenización Planta de Metales Nobles Ventanas"".",RCA,a,Leves,1.5,K,DIA,1.0499999999999998
La planta de tratamiento de aguas servidas no cuenta con un sistema de retención de macrodesechos,RCA,a,Leves,0.18,O,DIA,0.126
"Incumplimiento de los requisitos mínimos de los informes de resultados emitidos por la ETFA, de la siguiente forma: 1.	Falta de inclusión de la Declaración Jurada y firma de los Inspectores Ambientales en los informes individualizados en Tabla 8 de esta formulación de cargos; 2.	Inconsistencias en las fechas presentadas en los informes de ensayos LAB20-5454 y LAB21-0000; y en las declaraciones juradas asociadas.",Otro,d,Leves,,,,
"Ejecución de obras y actividades no consideradas en la evaluación ambiental del proyecto, a saber: a) Modificación de la descarga del efluente de la PTAS, utilizando las aguas servidas tratadas en el riego de pistas del Complejo Fronterizo; b) Cancha de secado de lodos; c) Pozo sin impermeabilizar para la acumulación de aguas servidas; d) Zona de lavado de camiones en suelo sin impermeabilizar; e) Confección de hormigón dentro de las instalaciones del proyecto; f) Extracción de agua desde un punto diferente al autorizado ambientalmente; y g) Acopio de material de escarpe y presencia de botadero utilizado para la disposición material pétreo y arenoso, además de residuos de hormigón (cunetas y soleras), tuberías plásticas, fierros y otras piezas de concreto y plásticos.",Otro,b,Graves,,,,
"Superar la producción máxima autorizada en el CES HUMOS 2, durante el ciclo productivo ocurrido entre 12 de octubre de 2018 y 23 de enero de 2020.",RCA,a,Graves,3.1,N,DIA,2.17
"La descarga de RILES se está efectuando en un lugar diverso al punto de muestreo definido en la RPM, de acuerdo a lo consignado en los considerandos 18.2, 20.2, 34.2, 34.3 y 45, letra a).",Otro,e,Leves,,,,
Producir una cantidad de aceite de oliva superior a lo autorizado.,RCA,a,Leves,,,,
"Las luminarias que forman parte del sistema de alumbrado ambiental y ornamental de Tecnofast La Negra, no cuentan con certificación de cumplimiento de los límites de emisión.",NE,h,Leves,,,,
"NO REPORTAR LOS REMUESTREOS SEGÚN LO ESTABLECIDO EN SU PROGRAMA DE MONITOREO Y/O LA NORMA DE EMISIÓN: El establecimiento industrial no reportó información asociada a los remuestreos de los siguientes parámetros conforme se detalla en la Tabla N° 1.3 del Anexo Nº 1 de la presente resolución: a)	Boro: febrero del año 2021; b)	Cloruros: octubre del año 2019; marzo, abril, mayo, junio, julio, agosto, septiembre, octubre, noviembre, diciembre del año 2020; enero, febrero, marzo, abril, mayo, junio, julio, agosto, septiembre, octubre, noviembre, diciembre del año 2021; c)	Hierro Disuelto: junio, julio del año 2021; d)	Manganeso: octubre del año 2019; marzo, abril, mayo, junio, julio, agosto, octubre, diciembre del año 2020; junio, octubre del año 2021; e)	N-Nitrato + N-Nitrito octubre del año 2019; marzo, mayo, junio, julio, agosto, septiembre, octubre, noviembre del año 2020; enero, febrero, marzo, abril, mayo, junio, agosto, septiembre, octubre, noviembre, diciembre del año 2021; f)	Nitrógeno Total Kjeldahl: junio y diciembre del año 2020; g)	Sulfato: octubre del año 2019; marzo, abril, mayo, junio, julio, septiembre, octubre, noviembre, diciembre del año 2020; enero, febrero, marzo, abril, mayo, junio, julio, agosto, septiembre, octubre, noviembre, diciembre del año 2021.",NE,g,Leves,,,,
No reportar en la plataforma electrónica de termoeléctricas el Formulario asociado a la la Unidad de Generación Eléctrica N° 1 de la Central Termoeléctrica Lautaro (UGE Lautaro I).,RSMA,e,Leves,,,,
F. Ausencia del último informe de monitoreo de fauna en estado de conservación.,RCA,a,Leves,250.0,I,EIA,175.0
"El establecimiento industrial no informó los remuestreos requeridos, para los meses y parámetros indicados en la Tabla N° 3 de la presente resolución.",NE,h,Leves,,,,
"SUPERAR EL LIMITE MÁXIMO PERMITIDO DE VOLUMEN DE DESCARGA EN SU PROGRAMA DE MONITOREO: El establecimiento industrial excedió el límite de volumen de descarga exigido en su Programa de Monitoreo (Res. Ex. SISS N° 2031, de fecha 02 de junio de 2011), en los meses de abril y septiembre del 2018; en el mes de octubre del 2019; y, en el mes de marzo del 2020; según se detalla en la Tabla N° 8 del Anexo de la presente Resolución.",NE,g,Leves,,,,
"Operación del tranque de relaves y de su sistema de control de infiltraciones de forma distinta a la autorizada. Lo que se observa en: a) Depositar relaves con un porcentaje de sólidos menor al 65%. b) Operar con un espejo de agua de manera permanente. c) No haber realizado captura de aguas en pozos de extracción de infiltraciones, previa autorización de la autoridad.",RCA,a,Graves,1900.0,I,EIA,1330.0
"""B. Se constata que la Planta de tratamiento de aguas servidas que se encuentra operando no tiene la correspondiente autorización y visación por parte de la Dirección General del Territorio Marítimo y Marina Mercante {""""DIRECTEMAR"""") la cual corresponde a un modelo y número de identificación distinto al solicitado, y posee certificación vencida.""",RCA,a,Leves,0.8,N,DIA,0.5599999999999999
"No haber realizado la medición de sus emisiones de MP, mediante una medición anual discreta para el horno a leña, para el periodo comprendido entre los años 2018-2019.",PPDA,c,Leves,,,,
"Instalación de obras y faenas al interior del Parque Nacional Lauca, particularmente: a) Un Lugar de acopio de residuos y dos botaderos de escombros, asfalto y estructuras metálicas, conforme a lo constatado en inspección de septiembre de 2013. b) Tres botaderos y un pozo de empréstito, constatados en la inspección de marzo de 2014. c) Pozo de empréstito N° 3, Botadero “Km. 136,9” e instalación de faenas, constatadas en la inspección ambiental de agosto de 2015. d) Dos conteiners, en el sector Chucuyo, utilizados como lugar de pernoctación de contratistas, constatados en la inspección de mayo de 2017. e) Botadero en la ribera Sur del Lago Chungará, en el Km. 180,340 de la Ruta 11 CH, constatado en la inspección ambiental de mayo de 2017.",RCA,a,Graves,17.1111,P,DIA,11.97777
"B1. La existencia de una piscina recubierta para almacenamiento de soluciones, adicional a la autorizada en la RCA 10/10",RCA,a,,12.5,I,DIA,8.75
"Incumplimiento al D.S. 29/2013, lo que se verifica en las siguientes circunstancias: (i) Titular sobrepasa en 12 ocasiones el valor de emisión de 50 mg/m3N sobre la base de valores horarios registrados por el CEMS del Horno N° 9, entre 2016 y 2018. (ii) Titular no informa parámetros de Compuestos Orgánicos Totales.",NE,h,Leves,1.05,C,EIA,0.735
