"La obtención, con fecha 12 de diciembre de 2019, de un Nivel de Presión Sonora Corregido (NPC) de 50 dB(A), efectuada en horario nocturno, en condición externa, en un receptor sensible ubicado en zona rural; y la obtención, con fecha 3 de marzo de 2020 de Niveles de Presión Sonora Corregidos (NPC) de 50, 53, 42 y 47 dB(A); con fecha 4 de marzo de 2020 de Niveles de Presión Sonora Corregidos (NPC) de 50, 53 y 44 dB(A); y con fecha 5 de marzo de 2020, de Niveles de Presión Sonora Corregidos (NPC) de, 50, 55, 41 y 47 dB(A), efectuadas en horario nocturno, en condición externa, en cuatro receptores sensibles, ubicados en zona rural.",NE,h,Graves,,,,
"La obtención, con fecha 23 de mayo de 2017, de Nivel de Presión Sonora Corregidos (NPC) de 69dB (A), medición efectuada en horario diurno, en condición interna, con ventana cerrada, en un receptor sensible ubicado en Zona II.",NE,h,Leves,,,,
Cerco perimetral en mal estado,RCA,a,Leves,0.635,,DIA,0.44449999999999995
"No se informó a la autoridad ni adoptó las acciones necesarias para controlar y mitigar los impactos ambientales no previstos, asociados a la disminución de ejemplares de Telmatobius dankoi.",RCA,a,Graves,230.0,I,EIA,161.0
"El establecimiento industrial excedió el volumen de descarga límite diario indicado en la Resolución Exenta N° 1.670/2006, de la SISS, que establece programa de monitoreo de la calidad del efluente generado, durante los períodos controlados correspondiente a los meses de Enero, Febrero, Marzo, Abril, Mayo, Junio, Julio, Septiembre, Octubre, Noviembre y Diciembre del año 2013, y Enero, Febrero, Marzo, Abril, Mayo, Junio, Julio, Agosto, Septiembre, Octubre, Noviembre y Diciembre del año 2014.",NE,g,Leves,,,,
Emplazamiento de estructuras asociadas a la explotación del CES Huillines 2 fuera del área de concesión acuícola,RCA,a,Graves,1.5,N,DIA,1.0499999999999998
"Ausencia de información relevante en los informes de Seguimiento Ambiental presentados a través del Sistema de Seguimiento Ambiental, manifestada en: a) El Informe de Calidad de Agua Segundo Semestre año 2015, no considera 77 puntos de monitoreo asociados al proyecto, los cuales se individualizan en el Anexo 15 del Informe DFZ-2016-832-I-RCA-IA. b) Falta de reporte, a través del Sistema de Seguimiento Ambiental, del compromiso de rehabilitación de los bofedales de la Quebrada de Chiclla, de conformidad con lo señalado en el capítulo 6.4.1 del EIA “Proyecto Minero Collahuasi”.",RSMA,e,Graves,7.5,I,DIA,5.25
No tener instalada una tabla de conversión de energía de leña en un lugar visible del establecimiento.,PPDA,c,Leves,,,,
"Superar la producción máxima autorizada en el CES MATILDE 2 (RNA 110778), durante el ciclo productivo que se extendió desde 6 de mayo de 2020 a 26 de mayo de 2021.",RCA,a,Graves,1.5,N,DIA,1.0499999999999998
"La obtención, con fecha 4 de noviembre de 2023, de un Nivel de Presión Sonora Corregido (NPC) de 69 dB(A), medición efectuada en horario nocturno, en condición externa y en un receptor sensible ubicado en Zona II.",NE,h,Leves,,,,
"24.1.2. Se constató la instalación y funcionamiento de fosas sépticas y de la planta de tratamiento de aguas servidas sin contar con autorización sanitaria previa, así como también la existencia de dos sistemas de alcantarillado de uso particular.",RCA,a,Leves,6.0,I,DIA,4.199999999999999
"No entregar el análisis de caracterización de las cenizas provenientes del horno incinerador luego del inicio de su operación, efectuada con fecha 1 de marzo de 2017.",RCA,a,Leves,0.15,O,DIA,0.105
"La obtención, con fecha 01 de octubre de 2017, de Nivel de Presión Sonora Corregidos (NPC) de 59 dB(A), medición efectuada en horario nocturno, en condición externa, en un receptor sensible ubicado en Zona II.",NE,h,Leves,,,,
No se entrega la información solicitada mediante Acta de Inspección Ambiental de fecha 5 de septiembre de 2019.,Requerimientos de Información,j,Leves,,,,
"La obtención, con fecha 12 de enero de 2019, de Niveles de Presión Sonora Corregidos (NPC) de 68 dB(A), 74 dB(A) y 73 dB(A), respectivamente, todas las mediciones efectuadas en horario nocturno, en condición externa, en receptores sensibles ubicados en Zona II.",NE,h,Leves,,,,
"La obtención, con fecha 19 de junio de 2018, de Nivel de Presión Sonora Corregido (NPC) de 57 dB(A), en horario nocturno, en condición interna con ventana abierta; medido en un receptor sensible, ubicado en Zona III",NE,h,Leves,,,,
"En el Horno Clinker, las emisiones de NOx están por sobre 300 kg/h en los periodos correspondientes al primer y segundo semestre de 2014, 2015, y segundo semestre 2016; y las emisiones de SO2 están por sobre 50 mg/m3N en los periodos correspondientes al segundo semestre de 2013, primer semestre de 2014 y segundo semestre 2015.",RCA,a,Graves,160.0,K,EIA,112.0
Omisión de entrega Programa de Vigilancia Ambiental (PVA): entrega incompleta de información y omisión absoluta de entrega con posterioridad a julio de 2017,RCA,a,Leves,1.45,O,DIA,1.015
"La obtención, con fecha 07 de enero de 2021, de Niveles de Presión Sonora Corregidos (NPC) de 70 dB(A) y 69 dB(A), ambas mediciones efectuadas en horario diurno, en condición interna con ventana abierta y en condición externa, respectivamente, en un receptor sensible ubicado en Zona II.",NE,h,Leves,,,,
"Haber efectuado modificaciones a la operación del Vertedero Victoria, respecto de lo evaluado mediante RCA N° 25/2010 y RCA N° 228/2014, en los siguientes aspectos: i) Extensión de la vida útil proyectada; ii) Aumento de capacidad de recepción de residuos.",RCA,a,Graves,1.8516,O,DIA,1.29612
"Haber operado, con fecha 15 de mayo de 2019 entre las 21:10 y las 21:35 horas, las calderas con registro números 326; 330; 1034; 1033; 329; 328 y; 327; y con fecha 09 de agosto de 2019, entre las 19:10 y las 20:05 horas, las calderas con registro números 330; 1034; 1033; 329; 328 y; 327; todas con una potencia superior a 75 kWt, durante un episodio crítico nivel Pre emergencia ambiental en el polígono B, sin haber acreditado la concentración de emisiones asociadas a las mismas para poder funcionar en un episodio de Pre emergencia",PPDA,c,Leves,,,,
"La obtención, con fecha 19 de marzo de 2022, de Niveles de Presión Sonora Corregido (NPC) de 52 dB(A), 52 dB(A) y 51 dB(A), todas las mediciones efectuadas en horario nocturno, en condición externa y en un receptor sensible ubicado en Zona III.",NE,h,Leves,,,,
"No se ha cumplido la medida de Plan de rescate y relocalización de suculentas en los siguientes aspectos: i)	No ha finalizado el trasplante de individuos involucrados en la medida, pese a haberse dado inicio a la etapa de construcción del Proyecto. ii)	No se dio aviso del inicio del rescate a la Superintendencia del Medio Ambiente, pese a haberse iniciado la ejecución de la medida. iii)	No se ha reportado ningún monitoreo correspondiente al seguimiento de la medida, pese a haberse iniciado la ejecución de la medida.",RCA,a,Leves,1000.0,B,EIA,700.0
"No realizar la entrega de la medición isocinética correspondiente al año 2013, requerida por la SMA en las inspecciones ambientales de 16 de octubre del año 2014 y de 7 de agosto del año 2015.",Requerimientos de Información,j,Leves,,,,
La no obtención de la certificación del CEMS instalado en Unidad Generadora de Electricidad N° 2 de Central Termoeléctrica Nueva Tocopilla habiendo vencido el plazo otorgado para obtenerla y persistiendo tal situación en la actualidad,NE,c,Leves,,,,
"Falta en la implementación de las medidas de contingencia ante pérdida de alimento de la piscicultura, toda vez que: 3.1 Se constató la presencia de pellet proveniente de la piscicultura en el cauce del río Rahue. 3.2 No se dio aviso a la autoridad sobre la contingencia de escape de alimento desde la piscicultura.",RCA,a,Leves,4.0,N,DIA,2.8
"Superar la producción máxima autorizada en el CES PAN DE AZÚCAR (RNA 120170), durante el ciclo productivo ocurrido entre el 21 de junio de 2021 al 20 de noviembre de 2022.",RCA,a,Graves,2.0,N,DIA,1.4
"La obtención, con fecha 25 de abril de 2023, de Niveles de Presión Sonora Corregidos (NPC) de 62 dB(A), 60 dB(A), 61 dB(A), 66 dB(A) y 64 dB(A), todas las mediciones efectuadas en horario nocturno, en condición externa la primera, tercera y cuarta y, en condición interna con ventana abierta la segunda y quinta, en un receptor sensible ubicado en Zona II.",NE,h,Leves,,,,
"La generación de malos olores los cuales fueron percibidos en distintas áreas de la unidad fiscalizable, según lo constatado en la fiscalización realizada con fecha 30 de septiembre del año 2019.",NE,a,Graves,,,,
"No remite información ambiental a la SMA, conforme lo exige la RCA (calidad de agua de riego y monitoreo de efluentes), desde año 2013 a la fecha.",RCA,a,Graves,0.092,L,DIA,0.0644
"Recibir residuos de origen no domiciliario en el Relleno Sanitario, constatado el 17 de junio de 2015.",RCA,a,Leves,12.7,O,EIA,8.889999999999999
"La obtención, con fecha 14 de enero de 2021, de un Nivel de Presión Sonora Corregido (NPC) de 73 dB(A), medición efectuada en horario diurno, en condición externa y en un receptor sensible ubicado en Zona II.",NE,h,Leves,,,,
"Utilización de un (1) calefactor unitario a leña por un establecimiento comercial emplazado en la zona saturada del polígono afecto al PDA de Coyhaique, durante inspección de fecha 12 de septiembre de 2017, en período de prohibición absoluta comprendido entre el 1 de abril y el 30 de septiembre.",PPDA,c,Leves,,,,
"En la fiscalización de 29 de septiembre de 2015, Portuaria Cabo Froward S.A. ejecuta parcialmente sus medidas de minimización de emisiones de polvo a la atmósfera lo que se traduce en: - La cinta transportadora, no está cubierta a lo largo de toda su extensión, presentando tramos sin cobertura. -Emisiones fugitivas de vapor y polvo de carbón, en las torres de transferencia.",RCA,a,Leves,17.0,F,DIA,11.899999999999999
"La obtención de un nivel de presión sonora corregido de 72 dba en horario diurno, con fecha de 22 de enero de 2015",NE,a,Leves,,,,
"La obtención, con fecha 8 de octubre de 2022, de unos Niveles de Presión Sonora Corregidos (NPC) de 49 dB(A), 57 dB(A) y 54 dB(A) mediciones efectuadas en horario nocturno, en condición interna, con ventana cerrada la primera y en condición externa las siguientes y en un receptor sensible ubicado en Zona II.",NE,h,Leves,,,,
"No reportar la frecuencia de monitoreo exigida en su Programa de Monitoreo. El establecimiento industrial no reportó la frecuencia de monitoreo exigida en su Programa de Monitoreo de Resolución Exenta N° 1355, de fecha 29 de octubre de 2018, de la SMA, para el parámetro Caudal en los períodos enero y febrero del 2022, conforme se detalla en la Tabla N° 1.1 del Anexo N° 1 de la formulación de cargos.",NE,g,Leves,,,,
La realización de un proyecto de desarrollo minero por parte de Minera Española Chile Limitada en la mina Panales 1 al 54 sin contar con una Resolución de Calificación Ambiental que autorice a efectuar dichas labores,Elusión,b,Graves,,,,
"No implementar medidas para mitigar la emisión de material particulado a la atmósfera en la operación de chancado del mineral, de conformidad con lo señalado en el considerando 3º letra b) de esta formulación de cargos.",RCA,a,Graves,0.0,I,DIA,0.0
"Comercio de leña con contenido de humedad sobre el 25%, verificado en la inspección ambiental de 18 de julio de 2016.",PPDA,c,Leves,,,,
"Presencia de elementos en desuso provenientes del Centro de cultivo, en playas aledañas a la concesión y en fondo marino.",RCA,a,Leves,0.0825,O,DIA,0.057749999999999996
Superar el límite máximo permitido de volumen de descarga en su programa de monitoreo.,NE,g,Leves,,,,
"NO REPORTAR LOS REMUESTREOS SEGÚN LO ESTABLECIDO EN SU PROGRAMA DE MONITOREO Y/O LA NORMA DE EMISIÓN: El establecimiento industrial no reportó información asociada a los remuestreos que se detallan en la Tabla N° 1.4 del Anexo de la presente resolución, respecto de los parámetros y en los periodos que a continuación se señalan: -Manganeso: en el mes de noviembre del año 2019; en los meses de febrero, abril, junio, julio, agosto, septiembre, octubre y noviembre del año 2020; y, en los meses de enero, febrero, marzo, junio, julio y septiembre del año 2021. -Sólidos Suspendidos Totales: en el mes de junio del año 2020. -Sulfuro: en el mes de julio del año 2020. -Temperatura: en el mes de julio del año 2020.",NE,g,Leves,,,,
"CMNSpA no realizó la captura de individuos de micromamíferos (roedores) durante la campaña correspondiente al año 2014, tal como consta en el Informe denominado “Estudio Monitoreo y Actualización de Línea de Base de los Recursos Bióticos (Fauna): Área de Influencia del Proyecto Pascua-Lama (2011-2014)”.",RCA,a,Leves,950.0,I,EIA,665.0
"Ejecución del proyecto de loteo Alto Maullín en un área colocada bajo protección oficial con afectación de suelo por procesos erosivos y fuerte pendiente, así como por corta de vegetación no autorizada, al margen del SEIA",Elusión,b,Graves,,,,
"Utilización, con fecha 02 de junio de 2017, de dos calefactores a leña de tipo combustión lenta en un establecimiento de servicios ubicado dentro de una zona declarada como saturada.",PPDA,c,Leves,,,,
"Operar una planta de tratamiento de aguas de origen domiciliario cuyas modificaciones atienden por si solas y en conjunto al proyecto original, a una población igual o mayor a dos mil quinientos (2.500) habitantes, sin contar con Resolución de Calificación Ambiental",Elusión,b,Graves,,,,
"Modificación de proyecto inmobiliario, consistente en partes, obras y acciones de un proyecto listado en el artículo 10 de la Ley N° 19.300 y el artículo 3 del RSEIA, sin contar con RCA, consistente en: - Partes, obras y acciones de un proyecto inmobiliario de desarrollo urbano que contempla obras de construcción y/o equipamiento. - Partes, obras y acciones de un proyecto inmobiliario en el Parque Nacional La Campana.",Elusión,b,Graves,,,,
"La obtención, con fechas 23 de septiembre y 27 de octubre de 2021, de Niveles de Presión Sonora Corregidos (NPC) de 66 dB(A) y 62 dB(A) respectivamente, mediciones efectuadas en horario diurno, en condición externa y en un receptor sensible ubicado en Zona II.",NE,h,Leves,,,,
"La obtención, con fecha 10 de abril de 2023, de Niveles de Presión Sonora Corregidos (en adelante, “NPC”) de 70 dB(A) y 62 dB(A); la obtención, con fecha 11 de abril de 2023, de NPC de 65 dB(A), 77 dB(A) y 69 dB(A); y, la obtención, con fecha 12 de abril de 2023, de NPC de 62 dB(A) y 72 dB(A); todas las mediciones efectuadas en horario diurno, en condición externa y en un receptor sensible ubicado en Zona II.",NE,h,Leves,,,,
"No obtención de aprobación sectorial correspondiente al permiso ambiental sectorial mixto del artículo 139 del D.S. N° 40/2012, relativo a la autorización sanitaria del tratamiento de Residuos Líquidos Industriales obtenidos del proceso de cutting y lodos orgánicos.",RCA,a,Leves,0.4201,O,DIA,0.29406999999999994
"No reemplazar la bomba de impulsión que presentó una falla (fuga), por una bomba de impulsión de respaldo, constatado con fecha 17 de junio de 2015.",RCA,a,Leves,12.7,O,EIA,8.889999999999999
CES Sureste Forsyth: Presencia de residuos y elementos en desuso propios de la actividad acuícola en borde costero aledaño a la concesión.,RCA,a,Leves,0.0197,N,DIA,0.013789999999999998
"F4. La existencia de residuos no peligrosos dispersos a un costado del patio de res. Pel. , dispuestos directamente sobre el terreno natural sin radier ni cierre perimetral.",RCA,a,,12.5,I,DIA,8.75
"Emplazamiento del trazado la línea de Transmisión Eléctrica difiere del trazado presentado en Adenda del Proyecto “Línea Eléctrica 110 kV Cardones Planta de Magnetita”, autorizado por la RCA 109/2006.",RCA,a,Graves,1.2,B,DIA,0.84
"La obtención, con fecha 03 de abril de 2019, un Nivel de Presión Sonora Corregidos (NPC) de 57 dB(A), medición efectuada en horario diurno, en condición externa, en un receptor sensible ubicado en Zona Rural.",NE,h,Leves,,,,
"La obtención, con fecha 20 de marzo de 2018, de un Nivel de Presión Sonora Corregidos (NPC) de 56 dB(A), medición efectuada en horario nocturno, en condición externa, en un receptor sensible ubicado en Zona III.",NE,h,Leves,,,,
"El establecimiento industrial no reportó con la frecuencia exigida en su programa de monitoreo, en los informes de autocontrol señalados en la Tabla N°3 de la presente Formulación de Cargos, consignándose además, que el mes de noviembre del año 2014, 2015 y 2016 no monitoreó los parámetros correspondientes al control normativo anual de la Tabla N°1 del D.S. N° 46/02, no incluidos en su programa de monitoreo, de acuerdo al numeral 3.5 de la Resolución Exenta SISS N° 2443/2010",NE,g,Leves,0.2,,,0.13999999999999999
"No haber dado cumplimiento al procedimiento frente a hallazgos no previstos, de tipo arqueológicos, paleontológicos o antropológicos, en tanto, respecto a hallazgos de 28 de mayo y 1° de octubre de 2014, y 4 y 12 de marzo de 2015, Metro: a.- No dio aviso inmediato y por escrito al CMN; b.- Procedió al rescate directo de los hallazgos, sin esperar las instrucciones del CMN.",RCA,a,Graves,1571.5,E,EIA,1100.05
No haber enterrado y reforzado el cerco perimetral de las piscinas PLS para la protección de fauna.,RCA,a,Leves,343.0,I,EIA,240.1
"La obtención, con fecha 16 de octubre de 2021, de Niveles de Presión Sonora Corregidos (NPC) de 57 dB(A) y 53 dB(A) respectivamente, mediciones efectuadas en horario nocturno, en condición interna, con ventana cerrada la primera y en condición externa la segunda, en un receptor sensible ubicado en Zona II.",NE,h,Leves,,,,
"Incumplimiento de los contenidos generales mínimos exigidos que deben incluir los Informes de Resultados de las actividades de análisis realizadas por la ETFA, en cuanto se verificó: •	Falta de identificación clara de el o los inspectores ambientales responsables de la actividad realizada por la ETFA; •	Falta de identificación del proyecto objeto de la labor de análisis, así como las partes objeto de dicha actividad; •	Identificación incorrecta del Instrumento Ambiental (Resolución de Calificación Ambiental) respecto al cual se realizó la labor de análisis.",Otro,d,Leves,,,,
"No haber ejecutado nuevamente la medición de fecha 19 de febrero de 2020 y la medición de fecha 11 de diciembre de 2020, para material particulado, de acuerdo a lo indicado en la Res. Ex. N°128/2019, SMA (reemplazada por la Res. Ex. N°2051/2021), en relación con lo señalado en el artículo 49 del D.S. N°8/2015, mediante un muestreo isocinético que permita acreditar el cumplimiento de los límites de emisión establecidos en el artículo 45 del D.S. N°8/2015, respecto de la caldera con registro N° SSAS 294.",PPDA,c,Leves,,,,
"La obtención, con fecha 8 de agosto de 2023, de un Nivel de Presión Sonora Corregido (NPC) de 75 dB(A), todas las mediciones efectuadas en horario diurno, en condición externa, en un receptor sensible ubicado en Zona II.",NE,h,Leves,,,,
"La obtención, con fechas 10 de febrero de 2018 y 13 de noviembre de 2018, de Niveles de Presión Sonora Corregidos (NPC) de 50 dB(A) y 61 dB(A), respectivamente, todas las mediciones efectuadas en horario nocturno, en condición externa, en un receptor sensible ubicado en Zona II",NE,h,Graves,,,,
No dar cumplimiento satisfactorio a las medidas de compensación del impacto muy significativo sobre la vegetación lo que se traduce en: i) No acreditar la reforestación de las 10 hectáreas adicionales a la superficie de bosque nativo cortada (20 ha) en predios rurales acordados con Conaf; ii) No mantener la condición de prendimiento de los ejemplares en los predios reforestados.,RCA,a,Graves,42.9,B,EIA,30.029999999999998
"El titular utilizó material de cobertura de residuos distinto al autorizado, para la cobertura diaria, toda vez que utilizó corteza de eucaliptus, en vez del material proveniente de la excavación, en parte del alvéolo 1.",RCA,a,Graves,18.0,O,EIA,12.6
Haber intervenido las áreas del Botadero Faja Fiscal N° 3 y el Botadero Provisorio sin contar con la aprobación de la Inspección Fiscal.,RCA,a,Leves,3.4,P,DIA,2.38
"No realizar nueva inspección visual en forma previa y con un mes de anticipación al inicio de las obras, con el fin de verificar la inexistencia de monumentos nacionales en su categoría de monumentos arqueológicos",RCA,a,Leves,11.0,C,DIA,7.699999999999999
E.1: Inexistencia de plantación frutal en un área de 5 ha.,RCA,a,,0.05,O,DIA,0.034999999999999996
Haber utilizado con fecha 9 de julio de 2018 un calefactor unitario a leña que no cumple con el D.S. N°39/2011.,PPDA,c,Leves,,,,
No implementar los drenajes de biogás en las zanjas.,RCA,a,Graves,0.0,,,0.0
"La obtención de un nivel de presión sonora corregido de 56 dba en horario nocturno, con fecha de 27 de junio de 2015.",NE,h,Leves,,,,
"La obtención, con fecha 18 de agosto de 2020, de un Nivel de Presión Sonora Corregido (NPC) de 73 dB(A), la medición efectuada en horario diurno, en condición interna, con ventana abierta, en un receptor sensible ubicado en Zona III.",NE,h,Leves,,,,
"La obtención, con fecha 27 de octubre de 2020, de niveles de Presión Sonora Corregidos (NPC) de 76 dB(A), 63 dB(A), 68 dB(A) y 67 dB(A), respectivamente, todas las mediciones efectuadas en horario diurno, la primera y la tercera en condición externa y la segunda junto con la cuarta en condición interna, con ventana cerrada, todas las mediciones realizadas en receptores sensibles ubicados en Zona II.",NE,h,Leves,,,,
"Afectación progresiva del estado de vitalidad de algarrobos (Prosopis flexuosa) en el área del Pozo Camar 2, según se detalla en la Tabla N° 3, sin asumir las acciones para controlar y mitigar dicho efecto ambiental ni informar a la autoridad, desde el año 2013 a la fecha",RCA,a,Graves,234.198,I,EIA,163.9386
"No dar cumplimiento a la obligación de efectuar monitoreo de napas, en los términos establecidos en el considerando 12.3 de la RCA, desde el año 2015 a la actualidad.",RCA,a,Leves,0.4347,E,DIA,0.30428999999999995
"El establecimiento industrial presentó superación del límite máximo permitido por la Tabla N°1 del artículo 10 del D.S. N°46/2002, para los parámetros incluidos en la Tabla N° 4 de la presente resolución, durante los meses de febrero, marzo, abril, mayo, junio, julio, septiembre y octubre del año 2014, y enero, febrero y marzo del año 2015; no configurándose los supuestos señalados en el artículo 25 del D.S. N°46/2002.",NE,h,Leves,,,,
"La obtención, con fecha 10 de marzo de 2018, de un Nivel de Presión Sonora Corregido (NPC) de 58 dB(A) respectivamente, medición efectuada en horario nocturno, en condición interna, en un receptor sensible ubicado en Zona II",NE,h,Leves,,,,
"La obtención, con fecha 11 de junio de 2022, de un Nivel de Presión Sonora Corregido (NPC) de 69 dB(A), medición efectuada en horario nocturno, en condición externa y en un receptor sensible ubicado en Zona II",NE,h,Leves,,,,
"La obtención, con fecha 08 y 09 de enero de 2018, de Nivel de Presión Sonora Corregido (NPC) de 46 dB(A), efectuada en horario nocturno, en condición externa, y medido en un receptor sensible ubicado en Zona II.",NE,h,Leves,,,,
"El establecimiento industrial presentó superación de caudal, durante los meses de octubre, noviembre y diciembre del año 2013, enero, marzo abril, mayo y octubre de 2014 y enero, febrero y marzo de 2015, tal como se presenta en la Tabla N°4 de esta Formulación de Cargos.",RCA,a,Leves,21.5,N,DIA,15.049999999999999
"El establecimiento industrial replica en sus reportes de autocontrol de los años 2015 a 2018, el mismo valor medido de volumen de caudal varias veces en el mes, de acuerdo a lo indicado en la Tabla N° 1 del Anexo de la formulación de cargos.",RCA,a,Leves,0.06,N,DIA,0.041999999999999996
"No mantuvo en el centro de cultivo “Canal Huito” las condiciones mínimas de seguridad establecidas en su RCA N°770/2012, en la etapa de operación, de acuerdo a las condiciones oceanográficas del área concesionada, cuya consecuencia fue el escape masivo de ejemplares desde el Centro. Lo anterior se expresa en lo siguiente: -La memoria de cálculo de fondeo de módulo 100 del año 2017, no cuenta con antecedentes fehacientes de corrientes oceanográficas imperantes del sector de emplazamiento, lo cual es parte de las bases para el diseño y adecuada instalación del módulo. -No realizó las respectivas verificaciones semestrales y anuales de los módulos de cultivo, sus elementos conformantes y el sistema de fondeo completo. -En relación a las redes (artes de cultivo), no se realizaron las revisiones diarias comprometidas en la evaluación ambiental para evitar el escape de peces de la jaula 104. -Se realizó la instalación deficiente de un tensor que aumentó el desgaste del material que componía la malla pecera y que no fue detectada oportunamente.",RCA,a,Graves,0.5,N,DIA,0.35
"El titular supera el volumen de disposición de Riles en hasta un 77% respecto del volumen máximo autorizado en período de vendimia, a la vez que su disposición se realiza en forma concentrada en una superficie de 4 hectáreas, la cual es menor que el área considerada en la evaluación ambiental.",RCA,a,Graves,0.015,O,DIA,0.010499999999999999
"Disponer los lodos generados por la PTR en un lugar que no cuenta con las autorizaciones de las autoridades respectivas, e incumpliendo además la normativa de manejo de lodos, en los periodos enero a mayo de 2017 y febrero a abril de 2018.",RCA,a,Graves,,,,
