"No informar a la SMA los cambios en las condiciones del Sistema de Tratamiento de RILes que modifican la cantidad y calidad del efluente proveniente del establecimiento, las que se expresan en: - Instalación de nuevas unidades en el Sistema de Tratamiento de RILes. -Unir en la cámara de recolección el efluente tratado mediante el lombrifiltro, compuesto por Riles y aguas servidas, con las aguas provenientes de la piscina de enfriamiento, las que son mezcladas de manera previa a su ingreso a la cámara de monitoreo, diluyendo el RIL generado por la planta.",RSMA,e,Graves,0.25,O,DIA,0.175
"La obtención de un nivel de presión sonora corregido de 48 dBA en horario nocturno, con fecha de 10 de junio de 2015.",NE,h,Leves,,,,
"NO REPORTAR LA FRECUENCIA DE MONITOREO EXIGIDA EN SU PROGRAMA DE MONITOREO: El establecimiento industrial no reportó la frecuencia de monitoreo exigida en su Programa de Monitoreo (Res. Ex. SISS N° 4703, de fecha 30 de diciembre de 2009) para los siguientes parámetros durante los períodos que a continuación se indican, y que se detallan en la Tabla Nº 4 del Anexo de la presente Resolución: a) Caudal: en los meses de enero, febrero, marzo, octubre, noviembre, diciembre de 2018; en los meses de enero, febrero, marzo, abril, mayo, agosto, septiembre, octubre, noviembre, diciembre de 2019; en los meses de enero, febrero, marzo de 2020. b) pH: en los meses de enero, febrero, marzo, octubre, noviembre, diciembre de 2018/ en los meses de enero, febrero, marzo, abril, mayo, junio, julio, agosto, septiembre, octubre, noviembre, diciembre de 2019/ en los meses de enero, febrero, marzo de 2020. c)Temperatura: en los meses de enero, febrero, marzo, octubre, noviembre, diciembre de 2018; en los meses de enero, febrero, marzo, abril, mayo, agosto, septiembre, octubre, noviembre, diciembre de 2019; en los meses de enero, febrero, marzo, abril de 2020",NE,g,Leves,,,,
No haber acordado con la autoridad sectorial los indicadores de cumplimiento y las medidas asociadas para prevenir y atender las alteraciones en la calidad relativos a los planes de vigilancia para alerta temprana de calidad del agua y control de arrastre de sólidos.,RCA,a,Graves,180.0,I,EIA,125.99999999999999
No haber reportado en el Sistema de Seguimiento Ambiental de esta Superintendencia los informes semestrales de monitoreo de aguas superficiales y subterráneas conforme al Plan de Monitoreo y Control.,RCA,a,Graves,2.2948,,DIA,1.6063599999999998
"El establecimiento industrial no reportó la frecuencia de monitoreo exigida en su Programa de Monitoreo en la resolución Exenta N° 3447, de fecha 22 de septiembre el año 2006, de la SISS, para los siguientes parámetros y períodos que a continuación se indican, y que se detallan en la Tabla N° 1.2 del Anexo N° 1 de la presente Resolución: - Mayo 2021: Aceites y grasas, Coliformes fecales o termotolerantes, DBO5, DQO, Fósforo, Nitrógeno Amoniacal, Nitrógeno total Kjeldahl, Poder espumógeno, Sólidos sedimentables, Temperatura y Ph. - Octubre 2021: Nitrógeno Amoniacal. - Diciembre 2021: Sólidos Sedimentables. - Octubre 2022: Nitrógeno amoniacal.",NE,g,Leves,,,,
"Haber operado la caldera a petróleo marca Sime, con una potencia térmica nominal superior a 75 kWt, durante un episodio crítico nivel Pre emergencia ambiental, con fecha 13 de mayo de 2021, entre las 21:15 y las 21:30 horas, sin haber acreditado la concentración de emisiones asociadas a la misma para poder funcionar durante un episodio de Pre emergencia.",PPDA,c,Leves,,,,
"La obtención, con fecha 18 de enero de 2023, de un Nivel de Presión Sonora Corregido (NPC) de 65 dB(A), en medición efectuada en horario diurno, en condición externa, en un receptor sensible ubicado en Zona Rural.",NE,h,Leves,,,,
"Operación del Vertedero Angol por sobre la vida útil proyectada para la disposición de los residuos sólidos domiciliarios, según lo dispuesto en su evaluación ambiental.",RCA,a,Leves,2.2948,,DIA,1.6063599999999998
"La obtención, con fecha 20 de diciembre de 2017, de un Nivel de Presión Sonora Corregidos (NPC) de 70 dBA, medición efectuada en horario diurno, en condición externa, en un receptor sensible ubicado en Zona III.",NE,h,Leves,,,,
"No existen gaviones para la delimitación del límite sur del sector playa del Humedal, a la fecha de la inspección ambiental.",RCA,a,Leves,0.0273,P,DIA,0.01911
"No realizar el análisis del efluente del equipo de autoclave luego de su instalación, efectuada con fecha 1 de marzo de 2015, y antes de la finalización de los 60 días de marcha blanca del mismo.",RCA,a,Leves,0.15,O,DIA,0.105
"La obtención, con fecha 20 de abril de 2019, de un Nivel de Presión Sonora Corregido (NPC) de 59 dB(A), medición efectuada en horario nocturno, en condición interna con ventana cerrada, en un receptor sensible ubicado en Zona II.",NE,h,Leves,,,,
"El establecimiento industrial no informó los reportes de autocontrol de su programa de monitoreo correspondiente al mes de septiembre de 2015; a los meses de enero y abril del año 2016; y los meses de enero, febrero, marzo, abril, mayo, junio, julio, agosto, septiembre, octubre y noviembre del año 2017 .",NE,g,Leves,,,,
"Manejo deficiente en la disposición de residuos, en cuanto a: •	Falta de compactación y de cobertura de la masa de residuos •	Disposición desordenada de los residuos. •	Deficiencias en la configuración y características de celdas y taludes",RCA,a,Graves,3.4,O,DIA,2.38
"El establecimiento industrial excedió el límite de volumen de descarga exigido en su Programa de Monitoreo (Resolución Exenta SMA N° 1361/2020, de fecha 6 de agosto de 2020)  en los períodos que a continuación se indican y que se detallan en la Tabla N° 1.5 del Anexo 1 de la presente Resolución: •	2021: octubre •	2022: enero, marzo, abril, julio, agosto, septiembre",NE,g,Leves,,,,
H1. No haber instalado balizas entre las torres.,RCA,a,Leves,1700.0,I,EIA,1190.0
"La obtención, con fecha 31 de enero de 2016, de Nivel de Presión Sonora Corregido (NPC) de 52 dB(A), en horario nocturno, en condición externa, ubicado en Zona III",NE,h,Leves,,,,
"NO REPORTAR LOS REMUESTREOS SEGÚN LO ESTABLECIDO EN SUPROGRAMA DE MONITOREO Y/O LA NORMA DE EMISIÓN: El establecimiento industrial no reportó información asociada a los remuestreos de los parámetros incluidos en la Tabla N° 1.4 del Anexo de la presente resolución, durante los meses de noviembre de 2019; febrero y mayo de 2020 y; mayo, junio y agosto de 2021.",NE,g,Leves,,,,
SUPERAR LOS LÍMITES MÁXIMOS PERMITIDOS PARA LOS PARÁMETROS DE SU PROGRAMA DE MONITOREO: El establecimiento industrial presentó superación del límite máximo permitido por la Tabla N° 1 del artículo 1 numeral 4.2 del D.S. N° 90/2000 para los parámetros que a continuación se indican durante los períodos que a continuación se señalan y que se detallan en indica la Tabla N° 4 del Anexo de esta Resolución; no configurándose los supuestos señalados en el numeral 6.4.2 del D.S. N° 90/2000: a) DBO5: en los meses de julio y agosto del año 2019; en el mes de mayo del año 2020. b) pH: en el mes de mayo del año 2020. c) Sólidos Suspendidos Totales: en los meses julio y agosto del año 2019; en el mes de mayo del año 2020. d)Tetracloroeteno: en el mes de julio del año 2019.,NE,g,Leves,,,,
A1. Omisión de ejecución de la medida de reforestación establecida en el plan de manejo.,RCA,a,Graves,250.0,I,EIA,175.0
"B4: La existencia de una bodega en que se almacenan RESPEL liquidos, ubicada a un costado de los servicios higienicos, cuyas canaletas de contención de derrames se encontraba obstaculizada con contenedores de residuos, pallet con motor y dos bidones de 20 litros.",RCA,a,Leves,1.6752,Ñ,DIA,1.17264
"Tránsito de vehículos de Alto Maipo por el área de influencia del proyecto, fuera del horario establecido en la RCA",RCA,a,Leves,700.0,C,EIA,489.99999999999994
"La obtención, con fecha 15 de enero de 2022, de un Nivel de Presión Sonora Corregido (NPC) de 62 dB(A) en horario nocturno, en condición externa y en un receptor sensible ubicado en Zona II.",NE,h,Leves,,,,
"La obtención, con fecha 6 de abril de 2018, de Niveles de Presión Sonora Corregidos (NPC) de 76 dB(A) con medición efectuada en horario diurno, en condición interna, con ventana abierta, en un receptor ubicado en Zona III.",NE,h,Leves,,,,
"24.3.2. Como consecuencia de la intervención irregular de un área de aproximadamente 15 hectáreas, detalladas en el numeral (i) del párrafo anterior, el titular no cumplió el compromiso de recolección superficial de al menos un 20% de los eventos líticos emplazados en dicha área, de manera previa a la instalación de las obras del proyecto.",RCA,a,Graves,6.0,I,DIA,4.199999999999999
"La obtención, con fechas 16 de noviembre y 09 de diciembre, ambos del año 2018, de Niveles de Presión Sonora Corregidos (NPC) de 57 dB(A) y 62 dB(A) respectivamente, todas las mediciones efectuadas en horario nocturno, en condición externa, en un receptor sensible ubicado en Zona II.",NE,h,Leves,,,,
"No efectuar acciones de reparación y mantención al cerco perimetral, en aquellos lugares en que se encuentra destruido y/o en mal estado, a la fecha de la inspección.",RCA,a,Leves,0.1468,O,DIA,0.10276
"Implementación incompleta del Plan de Contingencia frente a evento ocurrido el día 05 de marzo de 2020, específicamente: - No se determinó la magnitud del derrame de concentrado de plomo. - No se remitió informe final a la SMA con el detalle de las medidas de mitigación implementadas y fotografías que acreditaran su ejecución. - No se implementaron medidas vinculadas a la afectación directa o indirecta de avifauna. - No se remitieron informes a la SMA y al SAG sobre medidas vinculadas a la afectación de avifauna.",RCA,a,Leves,16.0,F,EIA,11.2
"La obtención, con fecha 25 de Noviembre del 2021, de un Nivel de Presión Sonora Corregido (NPC) de 62 dB(A), en condición externa, en horario nocturno y en un receptor sensible ubicado en Zona III.",NE,h,Leves,,,,
"Entrega de informe de medición de incompleto, específicamente no acredita aplicación de la metodología señalada en el D.S. 38/2011 en relación a ruido de fondo.",NE,j,Leves,15.0,N,DIA,10.5
"i) Manejo inadecuado de lodos provenientes de los equipos clarificadores, constatándose su acumulación en las cámaras de muestreo y contacto de la PTAS Labranza, y su posterior descarga en conjunto con el efluente proveniente de dicha PTAS al estero Brotolhue.",RCA,a,Graves,0.535,,DIA,0.3745
"Deficiencias en la captación, control y manejo de lixiviados generados en el relleno, de acuerdo a lo siguiente: •	No se evidencia la existencia de un sistema de tubería perforada, instalada a lo largo de la zanja actual de trabajo, ni sistema de tratamiento de los percolados. •	No haberse calificado como fuente emisora, de acuerdo con el D.S. N° 46/2002, habiéndose constatado en inspección de fecha 26 de junio de 2018 y 4 de julio de 2019, que los lixiviados estaban siendo conducidos mediante una manguera al predio adyacente, pudiendo observarse en esta última inspección, que estos eran depositados en un pozo de tierra sin impermeabilización; y en la inspección de 20 de mayo de 2020 la existencia de líquidos lixiviados en el frente de trabajo, sin contar con impermeabilización y ningún mecanismo o sistema para la conducción o contención temporal que impidan el escurrimiento libre al suelo y a las napas subterráneas. Por su parte, no existen suficientes antecedentes que permitan acreditar que el pozo donde se disponen los lixiviados generados al interior del Relleno, se encuentre impermeabilizado de manera efectiva.",NE,a,Graves,,,,
Construcción de una planta de lavado de camiones en diferentes condiciones y ubicación a las señaladas en las RCAs respectivas.,RCA,a,Leves,1.442,O,DIA,1.0093999999999999
"Descarga de aguas residuales al Interior de la Zona de Protección de Litoral con motivo de roturas en el emisario submarino, en las oportunidades a que se refieren los considerandos 60 al 65 de la formulación de cargos.",RCA,a,Graves,42.0,K,DIA,29.4
"La obtención, con fecha 01 de marzo de 2018 de un Nivel de Presión Sonora Corregidos (NPC) de 53 dbB(A), según la medición efectuada en horario nocturno, en condición interna, con ventana abierta, en un receptor sensible ubicado en Zona III.",NE,h,Leves,,,,
"La obtención, con fecha 02 de marzo de 2020, de un Nivel de Presión Sonora Corregido (NPC) de 67 dB(A), medición efectuada en horario diurno, en condición externa y en un receptor sensible ubicado en Zona rural.",NE,h,Leves,,,,
"La obtención, con fechas 4 y 21 de agosto de 2018 de Niveles de Presión Sonora Corregidos (NPC) de 67 y 61 dB(A) respectivamente, ambas mediciones efectuadas en horario diurno, en condición externa, en un receptor sensible ubicado en Zona Rural.",NE,h,Leves,,,,
"El establecimiento industrial, no informó en el autocontrol correspondiente al mes de febrero del año 2016, con la frecuencia requerida en su programa de monitoreo, los parámetros que se indican en la Tabla N° 3 de la presente resolución.",RCA,a,Leves,3.7,N,DIA,2.59
"Almacenamiento inadecuado de residuos, peligrosos y no peligrosos, lo que se constata en que: a) Ambos tipos de residuos se encontraban acopiados en el mismo lugar; b) Se observó almacenamiento de residuos peligrosos sobre suelo desnudo, sin control de acceso, ni techo; c) La zona de acopio de residuos peligrosos no estaba totalmente cerrada; y d) No existían elementos de control de incendios y señalización de seguridad conforme a la Norma Chilena NCh 2.190 Of 93 para residuos peligrosos.",RCA,a,Leves,90.26,I,EIA,63.182
"La obtención, con fecha 16 de agosto de 2017 de un NPC de 59 dB(A), medición efectuada en horario nocturno, en condición interna, con ventana abierta, en un receptor sensible ubicado en Zona II.",NE,h,Leves,,,,
"No cumplir con exigencia de Plan de Monitoreo de biogás y líquidos percolados, en tanto: A)	Se incumple la frecuencia del monitoreo de gases desde el año 2013. B)	No se monitorean todos los parámetros comprometidos de gases desde el año 2013. C)	No realiza monitoreo de percolados, desde el año 2013.",RCA,a,Graves,0.02,,,0.013999999999999999
"No contar con la aprobación y certificación del sistema de monitoreo continuo de emisiones de Material Particulado, respecto de la Unidad de Generación Eléctrica N° 2 de la Central Termoeléctrica Lautaro (UGE Lautaro II).",NE,c,Leves,,,,
No implementar techo y malla rachel en cuatro unidades del Sitio 1 y siete unidades del Sitio 2 del sistema de lombrifiltro.,RCA,a,Leves,30.0,L,DIA,21.0
"NO REPORTAR TODOS LOS PARÁMETROS DE SU PROGRAMA DE MONITOREO: El establecimiento industrial no reportó todos los parámetros de su Programa de Monitoreo (RPM N° 1930/2011) durante los periodos que a continuación se indican y que se detallan en la Tabla N°1.2 del Anexo N°1 la presente Resolución: -abril, junio, julio y agosto de 2021: Aceites y Grasas; Aluminio; Boro; Cadmio; Cromo Hexavalente; DBO5; Fluoruro; Fósforo; Hidrocarburos Fijos; Mercurio; Nitrógeno Total Kjeldahl; Pentaclorofenol; Plomo; Poder Espumógeno; Selenio; Sólidos Suspendidos Totales; Sulfatos; Sulfuros; Tetracloroeteno. -diciembre de 2021: Cianuro; Coliformes Fecales o Termotolerantes; pH; Temperatura; Triclorometano. -febrero de 2022: Ph y Temperatura. -octubre de 2022: Aceites y Grasas; Aluminio; Boro; Cadmio; Cromo Hexavalente; DBO5; Fluoruro; Fósforo; Hidrocarburos Fijos; Mercurio; Nitrógeno Total Kjeldahl; Pentaclorofenol; Plomo; Poder Espumógeno; Selenio; Sólidos Suspendidos Totales; Sulfato; Sulfuro; Tetracloroeteno. -noviembre de 2022: Temperatura -diciembre de 2022: Cianuro y Triclorometano.",NE,g,Leves,,,,
No ejecución de las medidas para el manejo de emisiones atmosféricas consistentes en estabilizar el camino de circulación interna con maicillo compactado y humedecer las vías de acceso y la carga de camiones.,RCA,a,Leves,5.0,H,DIA,3.5
"No reducción del 11% de las emisiones de SO2 en nivel de Alerta, de acuerdo al Plan Operacional 2022.",PPDA,c,Graves,,,,
"El establecimiento industrial, no informó con la frecuencia requerida en su programa de monitoreo, en los autocontroles de los períodos controlados correspondientes a los meses Octubre, Noviembre y Diciembre del año 2013, y el mes de Enero y Agosto del año 2014, los parámetros que se indican en la Tabla N°2 de la presente resolución.",RCA,a,Leves,5.0,N,DIA,3.5
El establecimiento industrial no informó sobre parámetro establecido en su programa de monitoreo durante el mes de abril del año 2018.,NE,a,Leves,,,,
"No realizar el seguimiento ambiental a la calidad de las aguas del Estero Pichil, de conformidad a lo establecido en sus resoluciones de calificación ambiental.",RCA,a,Leves,0.01,O,DIA,0.006999999999999999
"Utilización de un (1) calefactor unitario a leña (estufa de combustión lenta) por un establecimiento comercial emplazado en la zona saturada del polígono afecto al PDA de Coyhaique, durante inspección de fecha 22 de junio de 2016, en período de prohibición absoluta comprendido entre el 1 de abril y el 30 de septiembre.",PPDA,c,Leves,,,,
"NO REPORTAR LOS REMUESTREOS SEGÚN LO ESTABLECIDO EN SU PROGRAMA DE MONITOREO Y/O LA NORMA DE EMISIÓN: El establecimiento industrial no reportó información asociada a los remuestreos de los siguientes parámetros durante los períodos que a continuación se indican, y que se detallan en la Tabla N° 5 de la presente Resolución: a) DBO5: en los meses de enero, mayo, julio, agosto y septiembre del año 2019; en el mes de mayo del año 2020. b) pH: en los meses de enero y marzo del año 2019; en los meses de febrero y mayo del año 2020. c) Sólidos Suspendidos Totales: en los meses de enero, febrero, mayo, julio y agosto del año 2019; en el mes de mayo del año 2020. d)Tetracloroeteno: en el mes de julio de 2019. Artículo 1 D.S. N° 90/2000: “6. PROCEDIMIENTOS DE MEDICIÓN Y CONTROL  […] 6.4 Resultados de los análisis. 6.4.1. Si una o más muestras durante el mes exceden los límites máximos establecidos en las tablas N° 1, 2, 4 y 5, se debe efectuar un muestreo adicional o remuestreo. El remuestreo debe efectuarse dentro de los 15 días siguientes de la detección de la anomalía. Si una muestra, en la que debe analizarse DBO5, presenta además valores excedidos de alguno de los contaminantes: aceites y grasas, aluminio, arsénico, boro, cadmio, cianuro, cobre, cromo (total o hexalavante), hidrocarburos, manganesio, mercurio, níquel, plomo, sulfato, sulfuro o zinc, se debe efectuar en los remuestreos adicionales la determinación de DBO5, incluyendo el ensayo de toxicidad, especificado en el anexo B de la norma NCh 2313/5 Of 96”. DE LA INFRACCIÓN: LEVE, en virtud del numeral 3 del artículo 36 de la LO-SMA, que establece que son infracciones leves los hechos, actos u omisiones que contravengan cualquier precepto o medida obligatorios y que no constituyan infracción gravísima o grave, de acuerdo con lo previsto en los números anteriores de dicho artículo. RANGO DE SANCIÓN SEGÚN CLASIFICACIÓN: Amonestación por escrito o multa de una hasta mil UTA, según el literal c) del artículo 39 de la LO-SMA.",NE,g,Leves,,,,
"No se ejecutó de acuerdo a lo evaluado las medidas de compensación de impactos a flora y vegetación del proyecto Tugal, lo que se evidencia en: a)	No se acordó con la Comunidad Agrícola Olla de Caldera la zona donde se realiza la compensación. b)	No se realizó viverización ni plantación de Porlieria chilensis (guayacán) y Caesalpinia angulata (retamo). c)	No se realizó relocalización de especies leñosas. d)	No se verifica un 75% de sobrevivencia en plantación de entre 400 a 500 ejemplares de Balsamocarpon brevifolium (algarrobilla)",RCA,a,Graves,0.4,I,DIA,0.27999999999999997
No se realiza el retiro diario de las mortalidades de peces de cada unidad de cultivo,RCA,a,Leves,2.0,N,DIA,1.4
No dar cumplimiento satisfactorio a las medidas establecidas para mitigar emisiones atmosféricas,RCA,a,Graves,235.0,C,EIA,164.5
"Omisión de reportar sus monitoreos de calidad del agua los siguientes términos a) No reportó los autocontroles correspondientes a los meses de febrero de 2018 y abril de 2019. b) No reportó en sus autocontroles mensuales todos los parámetros asociados a su plan de monitoreo, para los siguientes parámetros y meses: - Nitrógeno Total: enero a mayo 2018, y en febrero de 2019. - Temperatura y pH: en mayo de 2019.",RCA,a,Leves,0.26,O,DIA,0.182
D2. La capacidad de la planta de tratamiento de riles es inferior a lo establecido en la RCA 84/2009,RCA,a,Leves,0.52,T,DIA,0.364
"La omisión de informar inmediatamente a la Superintendencia del Medio Ambiente la ocurrencia de impactos no previstos y de asumir acciones necesarias para abordarlos. El impacto no previsto ocurrido consistió en el deslizamiento cerro abajo de 3 rocas de gran tamaño, como producto de la ejecución de tronaduras durante el mes de marzo de 2017 desde dentro de los márgenes autorizados por la RCA N°351/2016 para el desarrollo de la fase II de Mina Uva, llegando, una de ellas, a una distancia de 180 metros de una vivienda particular.",RCA,a,Graves,7.0,I,DIA,4.8999999999999995
"No haber realizado la medición de sus emisiones de MP, mediante una medición anual discreta para su horno tipo chileno operativo al momento de la inspección que utiliza leña como combustible.",PPDA,c,Leves,,,,
"La obtención, con fecha 1 de septiembre de 2018, de Nivel de Presión Sonora Corregido (NPC) de 59, medición efectuada en horario nocturno, en condición externa, en un receptor sensible ubicado en Zona II.",NE,h,Leves,,,,
"Realizar un manejo de material de cama proveniente de los pabellones, diferente a lo dispuesto por la RCA N° 548/2003, lo que se verifica por las siguientes circunstancias: a. Reutilización sucesiva de parte del material de cama en los mismos pabellones, entre ciclos productivos. b.	Realización de proceso de estabilización microbiológica en el cual sólo se monitorea salmonella spp. c.	Acopio del material de cama, en “sector acopio de guano”, conforme se constató el 31 de agosto de 2015. d. Venta de parte del material de cama al final de cada ciclo productivo a terceros;",RCA,a,Graves,2.1,L,DIA,1.47
"A.1 .Omisión de contar con una obra de descarga de RILES del sistema de refrigeración del condensador, que penetre en el mar 30 metros desde el borde de la playa",RCA,a,Graves,460.0,C,EIA,322.0
"El establecimiento industrial no reportó la frecuencia de monitoreo exigida su Programa de Monitoreo (Res. Ex. SISS N°2737, de fecha 17 de agosto del año 2006) mensual asociado al D.S. N°90/2000, para los parámetros y períodos que a continuación se indican y que se detalla en la Tabla N°1.2 del anexo Nº1 de la presente Resolución: a)	El parámetro Caudal en los meses de junio, julio, agosto, noviembre y diciembre del año 2018; enero, febrero, marzo, abril, mayo, junio, noviembre y diciembre del año 2019; y, enero, febrero, marzo y abril del año 2020. b)	El parámetro pH en los meses de junio, julio, agosto, noviembre y diciembre del año 2018; enero, febrero, marzo, abril, mayo, junio, noviembre y diciembre del año 2019; y, enero, febrero, marzo y abril del año 2020. c)	Y, el parámetro Temperatura en los meses de junio, julio, agosto, noviembre y diciembre del año 2018; enero, febrero, marzo, abril, mayo, junio, noviembre y diciembre del año 2019; y, enero, febrero, marzo y abril del año 2020.",NE,g,Leves,,,,
"Superación de norma de emisión para Centrales Termoeléctricas en el año 2015, respecto de la Unidad Angamos N° 1 y N° 2 de la Central Termoeléctrica Angamos.",NE,h,Graves,54.0,C,DIA,37.8
"La obtención, con fecha 8 de diciembre de 2019, de Niveles de Presión Sonora Corregidos (NPC) de 48 dB(A) y 58 dB(A), ambas mediciones efectuadas en horario nocturno, en condición interna con ventana cerrada, en receptores sensibles ubicados en Zona II.",NE,h,Leves,,,,
"B1. La rotulación ilegible, incompleta y sin fecha de ingreso de los contenedores a la bodega de RESPEL.",RCA,a,Leves,50.0,C,DIA,35.0
No cumplir con el tipo de muestreo establecido en su programa de monitoreo en el mes de abril de 2019. La Tabla N° 6 del Anexo de la presente Resolución resume este hallazgo.,NE,g,Leves,0.143,K,DIA,0.10009999999999998
Almacenar en la bodega 15 residuos farmacéuticos de tipo psicotrópico.,RCA,a,Graves,,,,
"Superar el límite anual de extracción de áridos fijado por la RCA N° 60/2009 en 124.800 m3/año, al haber extraído durante el año 2020 una cantidad de 137.534,5 m3/año.",RCA,a,Leves,,,,
"No haber realizado la medición de sus emisiones de MP, mediante una medición anual discreta para los hornos a pellets, para el periodo comprendido entre los años 2018-2019.",PPDA,c,Leves,,,,
"Superar la producción máxima autorizada en el CES Morgan (RNA 120136), durante el ciclo productivo ocurrido entre el 10 de julio de 2017 y el 31 de marzo de 2019.",RCA,a,Graves,2.4,N,DIA,1.68
"Uso de laguna de emergencia, sin dar aviso a la autoridad.",RCA,a,Leves,1.6,H,DIA,1.1199999999999999
"Incumplimiento de las condiciones de la calificación favorable de la RCA N° 420/2009, respecto a los derechos de aguas que la empresa debería captar en la bocatoma aprobada ambientalmente, existiendo en la actualidad, solo un derecho legalmente constituido en el punto de captación, correspondiente a la Res. DGA N°705/2012",RCA,a,Graves,20.0,C,DIA,14.0
"Alteración no autorizada de 31 sitios arqueológicos no identificados en la evaluación ambiental del Proyecto LTE, según se da cuenta en la Tabla N° 6 de la presente resolución.",RCA,a,Graves,180.0,C,EIA,125.99999999999999
Aplicación de purines en zonas no autorizadas.,RCA,a,Graves,1.8,L,DIA,1.26
